<?xml version="1.0" encoding="UTF-8"?>
<!DOCTYPE deviceconfiguration SYSTEM "../../xml/dtd/deviceconfiguration.dtd">
<!--Created with OSSIE WaveDev Beta Version 0.6.0b-->
<!--Powered by Python-->
<deviceconfiguration name="DeviceManager" id="DCE:26555f88-e859-11db-97b9-00123f573a7f">
    <devicemanagersoftpkg>
        <localfile name="DeviceManager.spd.xml"/>
    </devicemanagersoftpkg>
    <componentfiles>
        <!--Device Definitions--> 
        <componentfile type="SPD" id="GPP1_51b862bc-d95c-11db-8b8d-00123f573a7f">
            <localfile name="xml/GPP/GPP.spd.xml"/>
        </componentfile>
        <componentfile type="SPD" id="USRP1_7c322634-e859-11db-8ffa-00123f573a7f">
            <localfile name="xml/USRP/USRP.spd.xml"/>
        </componentfile>
        <componentfile type="SPD" id="32d3bc8c-13e2-11dc-be81-00123f63025f">
            <localfile name="xml/soundCardCapture/soundCardCapture.spd.xml"/>
        </componentfile>
        <componentfile type="SPD" id="32555252-13e2-11dc-94ec-00123f63025f">
            <localfile name="xml/soundCardPlayback/soundCardPlayback.spd.xml"/>
        </componentfile>
    </componentfiles>
    <partitioning>
        <componentplacement>
            <componentfileref refid="GPP1_51b862bc-d95c-11db-8b8d-00123f573a7f"/>
            <componentinstantiation id="DCE:5ba336ee-aaaa-aaaa-aaaa-00123f573a7f">
                <usagename>GPP1</usagename> 
            </componentinstantiation>
        </componentplacement>
        <componentplacement>
            <componentfileref refid="USRP1_7c322634-e859-11db-8ffa-00123f573a7f"/>
            <componentinstantiation id="DCE:5ba336ee-bbbb-bbbb-bbbb-00123f573a7f">
                <usagename>USRP1</usagename> 
            </componentinstantiation>
        </componentplacement>
        <componentplacement>
            <componentfileref refid="32d3bc8c-13e2-11dc-be81-00123f63025f"/>
            <componentinstantiation id="DCE:459811e2-cccc-cccc-cccc-00123f63025f">
                <usagename>soundCardCapture1</usagename> 
            </componentinstantiation>
        </componentplacement>
        <componentplacement>
            <componentfileref refid="32555252-13e2-11dc-94ec-00123f63025f"/>
            <componentinstantiation id="DCE:4598fa94-dddd-dddd-dddd-00123f63025f">
                <usagename>soundCardPlayback1</usagename> 
            </componentinstantiation>
        </componentplacement>
    </partitioning>
    <domainmanager>
        <namingservice name="DomainName1/DomainManager"/>
    </domainmanager>
</deviceconfiguration>
