<?xml version="1.0" encoding="UTF-8"?>
<!DOCTYPE deviceconfiguration SYSTEM "../../xml/dtd/deviceconfiguration.dtd">
<!--Created with OSSIE WaveDev Beta Version 0.6.2-->
<!--Powered by Python-->
<deviceconfiguration id="DCE:2607c0a6-c54f-11dc-8920-000c29a1ba37" name="DeviceManager">
    <devicemanagersoftpkg>
        <localfile name="DeviceManager.spd.xml"/>
    </devicemanagersoftpkg>
    <componentfiles>
        <!--Device Definitions-->
        <componentfile id="soundCardPlayback1_990f5720-c546-11dc-bf44-000c29a1ba37" type="SPD">
            <localfile name="/xml/soundCardPlayback/soundCardPlayback.spd.xml"/>
        </componentfile>
        <componentfile type="SPD" id="32d3bc8c-13e2-11dc-be81-00123f63025f">
            <localfile name="xml/soundCardCapture/soundCardCapture.spd.xml"/>
        </componentfile>
        <componentfile id="GPP1_98faff14-c546-11dc-afee-000c29a1ba37" type="SPD">
            <localfile name="/xml/GPP/GPP.spd.xml"/>
        </componentfile>
    </componentfiles>
    <partitioning>
        <componentplacement>
            <componentfileref refid="soundCardPlayback1_990f5720-c546-11dc-bf44-000c29a1ba37"/>
            <componentinstantiation id="DCE:25f6dfa2-c54f-11dc-b355-000c29a1ba37">
                <usagename>soundCardPlayback1</usagename>
            </componentinstantiation>
        </componentplacement>
        <componentplacement>
            <componentfileref refid="32d3bc8c-13e2-11dc-be81-00123f63025f"/>
            <componentinstantiation id="DCE:459811e2-cccc-cccc-cccc-00123f63025f">
                <usagename>soundCardCapture1</usagename>
            </componentinstantiation>
        </componentplacement>
        <componentplacement>
            <componentfileref refid="GPP1_98faff14-c546-11dc-afee-000c29a1ba37"/>
            <componentinstantiation id="DCE:5ba336ee-aaaa-aaaa-aaaa-00123f573a7f">
                <usagename>GPP1</usagename>
            </componentinstantiation>
        </componentplacement>
    </partitioning>
    <domainmanager>
        <namingservice name="DomainName1/DomainManager"/>
    </domainmanager>
</deviceconfiguration>
